<?xml version="1.0" encoding="UTF-8"?>
        <!ELEMENT Ginasio (Persons,Machines)+>
        <!ELEMENT Persons (Clientes+,Employees+)>
        <!ELEMENT Clientes (Client+)>
        <!ELEMENT Employees (Instrutor+, Employee+)>
        <!ELEMENT Client (Nome,Idade,Numero,Password,Genero,Peso,Altura,ClientPack,DataInscricao,TaxaDeAtividadeFisica,person)>
        <!ELEMENT Nome (#PCDATA)>
        <!ELEMENT Idade (#PCDATA)>
        <!ELEMENT Numero (#PCDATA)>
        <!ELEMENT Password (#PCDATA)>
        <!ELEMENT Genero (#PCDATA)>
        <!ELEMENT Peso (#PCDATA)>
        <!ELEMENT Altura (#PCDATA)>
        <!ELEMENT ClientPack (#PCDATA)>
        <!ELEMENT DataInscricao (#PCDATA)>
        <!ELEMENT TaxaDeAtividadeFisica (#PCDATA)>
        <!ELEMENT person (#PCDATA)>
        <!ELEMENT Instrutor (Nome,Idade,Numero,Password,Genero,Cargo,DataContratacao,YearsOfContract,Experiencia,PtClientes,person)>
        <!ELEMENT Cargo (#PCDATA)>
        <!ELEMENT DataContratacao (#PCDATA)>
        <!ELEMENT YearsOfContract (#PCDATA)>
        <!ELEMENT Experiencia (#PCDATA)>
        <!ELEMENT PtClientes (ClientNome)*>
        <!ELEMENT ClientNome (#PCDATA)>
        <!ELEMENT Employee (Nome,Idade,Numero,Password,Genero,Cargo,Salario,DataContratacao,YearsOfContract,person)>
        <!ELEMENT Salario (#PCDATA)>
        <!ELEMENT Machines (Machine)+>
        <!ELEMENT Machine (Nome,DataDeCompra,Custo)>
        <!ELEMENT DataDeCompra (#PCDATA)>
        <!ELEMENT Custo (#PCDATA)>